,Product name,Description,Price,Rating,Overview,Category,Reviews,Favorites,Url,Images,Color 1,Color 2,Autoclass
1056,Swarovski vintage channel crystal set clip earrings.  Price is for 1 pair,"
            This is a stunning pair of vintage Swarovski earrings.  The size is 25mm.  These are clear crystal channel cluster earrings which are gold plated,  The clipsare fitted with a rubber component for comfort.
Colour:   Clear crystal with gold plating
Size:        25mm
If you have any questions, please do not hesitate to contact us through the etsy convo system
Box 24        ",55.72,4.9601,"Vintage Supply from the 1980s
Material:  crystal
Ships worldwide from  United Kingdom
Feedback:  323 reviews
Favorited by:  89 people",Jewelry Earrings Clip On Earrings Swarovski,323.0,89.0,https://www.etsy.com/listing/264958889/swarovski-vintage-channel-crystal-set,"https://img0.etsystatic.com/117/0/9322817/il_fullxfull.908240992_g1kc.jpg,https://img1.etsystatic.com/135/0/9322817/il_fullxfull.908011749_t3h2.jpg",,,101
1178,Sterling and rock crystal ring,"
            Wow! A beautiful emerald cut rock crystal sitting in a simple but elegant Sterling setting. Great color refraction in this piece. Size 7.75, sizeable by your jeweler.        ",60.00,5.0,"Vintage item from the 1950s
Materials:  rock crystal, sterling
Ships from  United States  to  select countries .
Feedback:  40 reviews
Favorited by:  20 people",Jewelry Rings Solitaire Rings engagement ,40.0,20.0,https://www.etsy.com/listing/484783066/sterling-and-rock-crystal-ring,"https://img1.etsystatic.com/179/0/12887316/il_fullxfull.1149817597_oll5.jpg,https://img1.etsystatic.com/177/0/12887316/il_fullxfull.1149817593_b989.jpg,https://img1.etsystatic.com/175/0/12887316/il_fullxfull.1149817589_qnwz.jpg,https://img1.etsystatic.com/151/0/12887316/il_fullxfull.1149817621_gne6.jpg",,,101
1222,Motörhead Ring,"
            VINTAGE...STERLING SILVER 925 """"Motörhead Ring""""  BIKER RING 
HIGHEST QUALITY  100% SOLID .925 STERLING SILVER (NOT PLATED).
STAMP .925 TRADEMARK INSIDE THE BAND.
FIRST CLASS BIKER RING JEWELRY,NICELY POLISHED.
RING WEIGHT :  15,7 Grams.
WE GUARANTEE THIS IS SOLID STERLING SILVER 925
****EACH PIECE OF JEWELRY COMES PACKAGED AND READY TO GIVE AS A GIFT***        ",161.00,5.0,"Vintage item from the 1980s
Material:  sterling silver 925
Ships worldwide from  Greece
Feedback:  40 reviews
Favorited by:  282 people",Jewelry Rings Statement Rings motorhead,40.0,282.0,https://www.etsy.com/listing/238788789/motorhead-ring,"https://img0.etsystatic.com/061/0/10364463/il_fullxfull.794966160_c4so.jpg,https://img1.etsystatic.com/067/0/10364463/il_fullxfull.794732493_dwpz.jpg,https://img1.etsystatic.com/068/0/10364463/il_fullxfull.794732671_ilej.jpg",,,101
2084,copper pendant light | vintage pendant light | vintage lighting | vintage copper light | antique light | vintage light / pendant light,"
            charming copper vintage pendant light
condition
great vintage condition
wired and ready to be hung
measurements
diameter 32 cm
height 39 cm
2.5kg        ",129.77,5.0,"Vintage item from the 1960s
Materials:  copper, metal
Ships from  Australia  to  select countries .
Feedback:  40 reviews
Favorited by:  45 people",Home & Living Lighting Chandeliers & Pendant Lights Pendant Lights,40.0,45.0,https://www.etsy.com/listing/385492940/copper-pendant-light-vintage-pendant,"https://img1.etsystatic.com/110/1/13096676/il_fullxfull.1034270739_lfrv.jpg,https://img0.etsystatic.com/108/1/13096676/il_fullxfull.987736574_su5l.jpg,https://img0.etsystatic.com/114/1/13096676/il_fullxfull.987736666_engw.jpg,https://img1.etsystatic.com/119/1/13096676/il_fullxfull.1034270917_ciog.jpg,https://img0.etsystatic.com/110/1/13096676/il_fullxfull.987736818_1pmn.jpg",,,101
2239,A pinchbeck and dark citrine open work fob seal/charm/pendant,"
            A beautiful fob seal/charm/pendant set with a dark faceted citrine stone, the item itself is that of open wire work and has han intergral  fluted loop for easy attachment to a chain or bracelet, the setting being 20x12mm and the height of the item being 26mm including the loop        ",46.43,4.9118,"Vintage item from the 1930s
Fabric: pinchbeck
Finish: citrine
Materials:  pinchbeck, citrine
Ships worldwide from  United Kingdom
Feedback:  137 reviews
Favorited by:  89 people",Jewelry Bracelets Charm Bracelets pinchbeck,137.0,89.0,https://www.etsy.com/listing/185381025/a-pinchbeck-and-dark-citrine-open-work,"https://img1.etsystatic.com/044/0/7306716/il_fullxfull.586512999_nsod.jpg,https://img0.etsystatic.com/044/0/7306716/il_fullxfull.586406278_4uue.jpg,https://img0.etsystatic.com/030/0/7306716/il_fullxfull.586406370_4qff.jpg,https://img1.etsystatic.com/043/0/7306716/il_fullxfull.586513237_2v5b.jpg,https://img0.etsystatic.com/032/0/7306716/il_fullxfull.586406494_bn62.jpg",,,101
2243,charming little golf bag charm / vintage charm / vintage silver charm / solid silver charm / sterling silver charm / golf clubs charm,"
            charming solid silver golf bag charm        ",17.87,5.0,"Vintage item
Ships from  Australia  to  select countries .
Feedback:  40 reviews
Favorited by:  12 people",Jewelry Bracelets Charm Bracelets silver charm,40.0,12.0,https://www.etsy.com/listing/474940815/charming-little-golf-bag-charm-vintage,"https://img1.etsystatic.com/134/2/13096676/il_fullxfull.1082005107_6ijf.jpg,https://img1.etsystatic.com/107/0/13096676/il_fullxfull.1079173133_3c1j.jpg",,,101
3400,"Exquisite, Rare Vintage Native American Geometric Design Beaded Purse Wallet","
            This wallet is exquisite. It is such fine Native American beadwork. I am guessing from the 1950's based on the style of the wallet. Most of the work is done with beautiful cut beads. The edging is done with tiny, tiny beads. Just amazing. The colors are gorgeous!  Museum quality beadwork. Possibly Plains but would love to hear if any expert out there has an idea!!
The are two small areas of loss. I always meant to have it restored but never did. The last photo shows the loss near the clasp. The photo of the back, of the wallet, shows the loss near the bottom of the right side. Even with this loss this piece is still a rare find. A true collectible piece. 
The interior looks like it is faux leather but may be genuine. There is a metal zipper pocket. Moiré-like material lines the inside. 
The wallet measures 7"" x 5"".  Inside the flap area it looks completely unused. The coin area, which opens at the top, shows some use. Slight wear where the hinges are which is to be expected from use and age. Nothing major. It is in wonderful functioning order and could be used if so desired. I always have just had it on display. 
Let me know if you have any questions!  I do consider offers as well!
All Sales Final
Thanks for visiting and please take a peek at my other Etsy shop Gypsy Treasure Vintage.        ",300.00,4.9167,"Vintage item from the 1950s
Materials:  Leather, Faux Leather, Metal, Beads, Glass Beads
Only ships within  United States .
Feedback:  40 reviews
Favorited by:  31 people",Bags & Purses Wallets & Money Clips Wallets Geometric Design,40.0,31.0,https://www.etsy.com/listing/385581368/exquisite-rare-vintage-native-american,"https://img0.etsystatic.com/118/0/8682776/il_fullxfull.988114514_rnrf.jpg,https://img0.etsystatic.com/129/0/8682776/il_fullxfull.988114696_pms0.jpg,https://img0.etsystatic.com/124/0/8682776/il_fullxfull.988115246_9z75.jpg,https://img1.etsystatic.com/127/0/8682776/il_fullxfull.1034648213_c662.jpg,https://img1.etsystatic.com/125/0/8682776/il_fullxfull.1034648289_noxl.jpg",,,101
3542,Vintage Toddler Jacket Vintage Yellow Applique Toddler Coat Vintage Pert'n Sassy Styled by Miss Bea Toddler's Coat,"
            Estate Sale Find
Vintage Pert'n Sassy styled by Miss Bea Toddlers Jacket/Coat
Tagged: Pert'n Sassy Styled by Miss Bea
Machine wash warm Tumble dry
Machine wash warm water Gentle Cycle Do not use Chlorine Bleach Use Cool Iron
RN# 21386
50% Polyester 50% Cotton
Eb Style 2158-1
Size M
Yellow with blue top stitching
6 blue buttons down the front
Sweet applique of mouse, mushrooms and lady bug
In very good condition, no stains that I can find
The stitching in back top of dart need to be reinforced
No rips or tears
Center front to bottom is 13 inches
Under arm to under arm is about 12.5 inches
Neck opening is about 11.5 inches
Really adorable piece!
Most of our items are estate sale finds and in vintage used condition, please view photos carefully and feel free to contact us with any questions that you may have.        ",18.00,5.0,"Vintage item from the 1970s
Materials:  Cotton, Polyester
Only ships within  United States .
Feedback:  244 reviews
Favorited by:  89 people",Clothing Girls' Clothing Jackets & Coats Toddler Coat,244.0,89.0,https://www.etsy.com/listing/234357776/vintage-toddler-jacket-vintage-yellow,"https://img1.etsystatic.com/064/1/5988819/il_fullxfull.776041047_d86i.jpg,https://img0.etsystatic.com/068/0/5988819/il_fullxfull.776001086_8xd2.jpg,https://img0.etsystatic.com/066/0/5988819/il_fullxfull.776001146_r0ab.jpg,https://img0.etsystatic.com/064/0/5988819/il_fullxfull.776001206_lx20.jpg,https://img0.etsystatic.com/062/0/5988819/il_fullxfull.776001298_d3uf.jpg",,,101
4166,YVES SAINT LAURENT bag vintage Mondrian Yves Saint Laurent bag Mondrian,"
            Yves Saint Laurent bag vintage leather and suede 80s spirit Mondrian
Colour violet and Red bordeaux photos eclaircissent the color of the bag
This bag is vintage traces on the visible suede on shadow leather is in excellent condition
The Interior is lined in fabric Monogram impeccable zipped patch Pocket
Main zipper double Cove
Height 23 cm width 30 cm
You look at a bag that has more than 30 years and not a new bag price takes into account the signature and his condition feel free to ask me questions
Thank you for visiting        ",133.24,4.6296,"Vintage item from the 1980s
Material:  cuir et daim
Ships worldwide from  France
Feedback:  40 reviews
Favorited by:  125 people",Bags & Purses Handbags Shoulder Bags Mondrian Ysl,40.0,125.0,https://www.etsy.com/listing/262749837/yves-saint-laurent-bag-vintage-mondrian,"https://img0.etsystatic.com/159/0/11080206/il_fullxfull.1113974436_9wao.jpg,https://img1.etsystatic.com/111/0/11080206/il_fullxfull.898511701_no76.jpg,https://img1.etsystatic.com/116/0/11080206/il_fullxfull.898511791_6d6m.jpg,https://img1.etsystatic.com/111/0/11080206/il_fullxfull.898511861_a37i.jpg,https://img0.etsystatic.com/165/0/11080206/il_fullxfull.1113974448_i7uw.jpg",,,101
4460,"Vintage Samsonite Silhouette Dark Gray Faux Leather Carry-On Suitcase, Vintage Vinyl Luggage, Retro Faux Leather Luggage, Great condition","
            Welcome to my Junkgle- It gets better here every day!
You have your eye on this nice Samsonite Faux Leather Travel Bag.
It is from the Silhouette Series, and (fittingly) is a Dark Gray.
It is hoping to find someone to continue its travel with- it is quite the adventurer!.
  
It is 22in x 12in x 7in. With one compartment, which is closed by a jumbo zipper.
it doesn't have a key, but it does have the lock, if it's any consolation.
It is in great functional physical condition, but does have a few cosmetic flaws:  It acquired a streak or two of white and got a couple tears in the edging on its' previous adventures. (see pics)
 The streak may be removable or could be colored over if you choose. The torn pieces are still attached and could be glued in place again.
Besides that it is nearly new. 
This item, like most of the items i have for sale, besides my original creations, came to me as rescues. I do not know their history, but i try to get to know them well before I find them a home. I give them cleanings when necessary and i'm able, but there may be more to touch up depending on the item and/ or your taste.
I try to represent all my items honestly and thoroughly in the photos and descriptions, Please look closely at the photos and consider them an integral part of the description- (i can only type so much:)
That said, there may be some personality traits that i didn't mention  or observe, or was unaware of. so if you have any questions please ask.
If any item you see or receive is not as described, within reason, I assure you it was not intentional. Please contact me and i will do whatever is necessary to make the situation right. 
I want to spread happiness and harmony, not confusion and chaos.        ",29.00,5.0,"Vintage item
Only ships within  United States .
Feedback:  40 reviews
Favorited by:  60 people",Bags & Purses Luggage & Travel Suitcases Vintage Luggage,40.0,60.0,https://www.etsy.com/listing/289893739/vintage-samsonite-silhouette-dark-gray,"https://img0.etsystatic.com/152/0/12620524/il_fullxfull.1111474502_7skk.jpg,https://img1.etsystatic.com/156/0/12620524/il_fullxfull.1158080911_jx6m.jpg,https://img1.etsystatic.com/149/0/12620524/il_fullxfull.1158080897_sjfz.jpg,https://img1.etsystatic.com/142/0/12620524/il_fullxfull.1158080883_k6ot.jpg,https://img0.etsystatic.com/157/0/12620524/il_fullxfull.1111474592_6nt3.jpg",,,101
4543,Vintage wallet,"
            Vintage leather wallet 70 years        ",33.31,5.0,"Vintage item from the 1970s
Ships worldwide from  Italy
Feedback:  8 reviews
Favorited by:  89 people",Bags & Purses Pouches & Coin Purses vintage leather,8.0,89.0,https://www.etsy.com/listing/240011154/vintage-wallet,"https://img0.etsystatic.com/067/0/10027556/il_fullxfull.799904332_tuis.jpg,https://img1.etsystatic.com/066/0/10027556/il_fullxfull.799674059_lo2f.jpg,https://img1.etsystatic.com/061/0/10027556/il_fullxfull.799674065_5itt.jpg",,,101
4893,Old Coin Lot from the Holy Land & US mini Gold coin Gift,"
            Unsorted and uncleaned , Bag of OLD COINS form the Holy Land
take a look at the photographs , You will always get more.
Give the Beginner coin collector the opportunity to 
clean, Sort and Research the coins.
  
Great for A Jewelry Maker looking for that Exotic coin to use.
 or A Young Collector of Coins to gain Experience with old coins.
Every Order will receive A mini GOLD U.S. COIN in the photos.  
Thank you for viewing my listings. 
This Item will  be sent by Registered mail with A Tracking Number.
Hi please take the time and visit my store new Items daily:
https://www.etsy.com/shop/OldPawn?ref=hdr_shop_menu
        ",17.75,5.0,"Vintage item from the 1970s
Materials:  Coin, metal, gold
Ships worldwide from  Israel
Feedback:  40 reviews
Favorited by:  380 people",Art & Collectibles Collectibles Coins & Money Old Coin,40.0,380.0,https://www.etsy.com/listing/235816590/old-coin-lot-from-the-holy-land-us-mini,"https://img1.etsystatic.com/061/0/11179025/il_fullxfull.781832049_1hwc.jpg,https://img1.etsystatic.com/068/0/11179025/il_fullxfull.781832111_ca8y.jpg,https://img0.etsystatic.com/062/0/11179025/il_fullxfull.782130274_kouf.jpg,https://img0.etsystatic.com/066/0/11179025/il_fullxfull.782130426_dlfj.jpg,https://img0.etsystatic.com/061/0/11179025/il_fullxfull.782130480_esh6.jpg",,,101
5023,"Early 1800s Continental pewter bowl, by Jean Baptist Duvivier.  Georgian porridge bowl.","
            This very nice Georgian pewter porridge bowl was made by Jean Baptist Duvivier (1798-1870), a well known pewterer from Ghent, Belgium.
Some of his work can be seen in Belgian musea: 
http://balat.kikirpa.be/results.php?linkthrough=VV&linkval=Duvivier%2CJeanBaptist
Jean Baptist started in 1815 as a seventeen years old apprentice and retired around 1850. 
This fine porridge bowl from around 1830 shows signs of use and age but is still in very good condition. (see pictures)
dimensions: length with handles: 23.5 cms/ 9.25 inches
                    diameter : 16 cms/ 6.30 inches
                    height : 5.5 cms/ 2.15 inches        ",111.04,4.9091,"Vintage item from the 1800s
Material:  pewter
Ships worldwide from  Belgium
Feedback:  40 reviews
Favorited by:  280 people",Art & Collectibles Collectibles Collectible Plates pewter,40.0,280.0,https://www.etsy.com/listing/235238862/early-1800s-continental-pewter-bowl-by,"https://img1.etsystatic.com/065/1/7333670/il_fullxfull.779727193_hg22.jpg,https://img1.etsystatic.com/066/1/7333670/il_fullxfull.779727163_8soy.jpg,https://img0.etsystatic.com/065/0/7333670/il_fullxfull.779728120_7fxj.jpg,https://img1.etsystatic.com/067/0/7333670/il_fullxfull.779727325_a99g.jpg,https://img0.etsystatic.com/061/0/7333670/il_fullxfull.779728192_mysn.jpg",,,101
5145,20 ITALY stamps collection - Cute vintage Italian assorted set,"
            Set of 20 assorted italian vintage stamps. 
Perfect for scrapbooking, arts and crafts projects, collages, decoupage…
Different times and amounts.
All stamped by post.
Perfect for collectibles.
Packs are different and may vary, but photos are very representative of items you will get.
Pieces will be randomly selected.
(S-32)        ",3.10,4.8606,"Vintage Supply from the 1970s
Material:  stamps
Ships worldwide from  Spain
Feedback:  1378 reviews
Favorited by:  89 people",Art & Collectibles Collectibles Postage Stamps vintage,1378.0,89.0,https://www.etsy.com/listing/189915413/20-italy-stamps-collection-cute-vintage,"https://img1.etsystatic.com/032/0/5940632/il_fullxfull.603568855_m60b.jpg,https://img1.etsystatic.com/039/0/5940632/il_fullxfull.603568909_p4ee.jpg,https://img0.etsystatic.com/041/0/5940632/il_fullxfull.603466672_8pvv.jpg",,,101
5172,"6c American Buffalo stamp .. Pack of 20 Unused postage stamps .. Vintage postage stamps. Old West, Wildlife Conservation, Great Plains USA","
            Pack of 20 Vintage Unused US Postage stamps of the:
6 cent American Buffalo Wildlife Conservation Commemorative stamp.
Issued July 20, 1970
Scott catalog #: 1392
From a time when there were millions of them roaming across much of the continent, to a time when their numbers were reduced to two small herds in all of North America, the American buffalo went through bad times after the white man came to this part of the world. They were killed for sport, slaughtered. The efforts of the American Bison Society were instrumental in redirecting the bisons' future. In 1894 the U.S. Department of the Interior prohibited the killing of any more buffalo in Yellowstone National Park. Slowly the herds began to grow. 
You will receive 20 Mint unused postage stamps with original gum as issued by the Post Office. These stamps are genuine and valid to use as postage for current mailing. Be sure to use enough total postage to meet the current postage rate for mailing a letter if you want to use them mailing. 
Also good to use for scrapbooking or displaying in a small picture frame. It's a miniature work of art.
If you would like me to put a custom order together that includes this stamp please convo me with your questions or request a custom order. I have a large inventory of Vintage US Postage stamp for you to buy from.        ",6.95,4.9874,"Vintage item from the 1960s
Primary color: Brown
Secondary color: Black
Holiday: Thanksgiving
Occasion: Wedding
Materials:  US postage stamps, postage stamps, stamp, paper, ink, glue
Ships worldwide from  United States
Feedback:  2354 reviews
Favorited by:  89 people",Art & Collectibles Collectibles Postage Stamps postage stamp,2354.0,89.0,https://www.etsy.com/listing/472211519/6c-american-buffalo-stamp-pack-of-20,"https://img0.etsystatic.com/135/0/5219082/il_fullxfull.1025405828_ogeq.jpg,https://img1.etsystatic.com/134/0/5219082/il_fullxfull.1071939827_k28v.jpg",,,101
5284,"Antique Botanical Illustration, Beige, Neutral Color Decor, Wildflower Art, Rustic Flower Print, 5"" x 7.75"", Vintage Wall Art,  Dogwood (31)","
            This beautiful illustration, by American botanical artist Marion Satterlee, is of a wildflower called Round-Leaved Dogwood.  It's a black and white illustration that has aged to a lovely buff color.  The opposite side of the page has text.
It is an original illustration that was carefully removed from an antique book published in 1900, not a copy, reproduction or digital download.
Because it is over 100 years old, there are some minor flaws.  There may be some minor foxing, creases or glue along the edges from where it was removed from the book. Any flaws around the border could be easily covered by a mat before framing.  
The print does not come matted or framed.
The approx. size of the page is 5"" x 7.75"" (12.7 cm x 19.685 cm).  It could be easily trimmed down to fit a standard 5"" x 7"" mat or frame.
For more of these wildflower illustrations:
https://www.etsy.com/shop/VintageButtercup?ref=hdr_shop_menu&search_query=marionsatterlee
For more botanical prints:
https://www.etsy.com/shop/VintageButtercup?section_id=18887605
If purchasing multiple wildflower illustrations, click this link for discounted sets of 2, 3, 4 and 6 prints:
https://www.etsy.com/shop/VintageButtercup/search?search_query=setofprints&order=date_desc&view_type=gallery&ref=shop_search
        ",6.00,4.9865,"Vintage item from 1900 - 1909
Materials:  paper, ink
Ships worldwide from  United States
Feedback:  767 reviews
Favorited by:  89 people",Art & Collectibles Drawing & Illustration Pen & Ink Shabby Cottage Decor,767.0,89.0,https://www.etsy.com/listing/292791341/antique-botanical-illustration-beige,"https://img0.etsystatic.com/125/1/5813188/il_fullxfull.970806928_55of.jpg,https://img0.etsystatic.com/105/0/5813188/il_fullxfull.970807208_ssez.jpg,https://img1.etsystatic.com/119/0/5813188/il_fullxfull.1017341637_jq8n.jpg,https://img0.etsystatic.com/133/0/5813188/il_fullxfull.970807184_365z.jpg,https://img1.etsystatic.com/103/0/5813188/il_fullxfull.1017341845_ici1.jpg",,,101
5784,1920s Ecru Cloche Hat,"
            Vintage 1920s ecru cloche hat, made from a woven stiff synthetic fiber.  It has grosgrain ribbon trim, and a bow on the back.  It has beige silk lining.  In good condition for its age -- the silk lining is shredding in spots, and the hat overall is dingy.  No holes or major stains, just a little foxing from age. It measures 8"" tall from the brim to the top, and the interior circumference is 21"".
Visit the rest of our shop for more goodies ---  
https://www.etsy.com/shop/BlackbirdAntiquesNC
Visit our shop policies page for sizing info, shipping guidelines, and more ---  
https://www.etsy.com/shop/BlackbirdAntiquesNC/policy
***
Find us on Instagram @blackbirdantiquesnc or
Facebook ---  https://www.facebook.com/blackbirdgirlsvintage or
Pinterest ---  https://www.pinterest.com/4and20/        ",89.00,4.9041,"Vintage item from the 1920s
Primary color: Beige
Materials:  ribbon, silk, woven fiber
Only ships within  United States .
Feedback:  2175 reviews
Favorited by:  89 people",Accessories Hats & Caps Formal Hats Cloche Hats,2175.0,89.0,https://www.etsy.com/listing/463007771/1920s-ecru-cloche-hat,"https://img0.etsystatic.com/137/1/6052273/il_fullxfull.1000146152_prwy.jpg,https://img1.etsystatic.com/115/0/6052273/il_fullxfull.1046675949_6o47.jpg,https://img1.etsystatic.com/125/0/6052273/il_fullxfull.1046675969_ssou.jpg,https://img1.etsystatic.com/128/0/6052273/il_fullxfull.1046675975_bn2s.jpg,https://img1.etsystatic.com/106/0/6052273/il_fullxfull.1046676091_24pg.jpg",,,101
5789,1950's Mr. John Hat / Ladies 100% Wool Excello Mr.John Classic NY Paris Black Feather Hat,"
            This is a fantastic Vintage Classic Mr. John Ladies Hat looking as though it came right out of the movie, ""The Three Musketeers"" or ""ZERO""!
This hat is a 100% wool, Excello, Mr John Classic, NY, Paris Black Ostrich Feather Hat.
It was sold through Geo. W Bollman & Co. Inc.
It measures 13"" from front to back and is 12 1/2"" from side to side.
I cannot find the exact size but the inner crown is 22"" around.
It has the Mr. John cloth tag and the Geo. W Bollman stamp inside the hat and comes in the original Mr. John Hat box.
The hat has no stains, or wear at all.
It is a wonderful classic designer hat for any hat collectors or High Society. Great for formal wear or use for costume wear.
Please READ MY LISTING CAREFULLY and ask all questions before buying. Being Vintage and/or Antique means this piece has been loved by others in the past and there are NO RETURNS. I will be more than happy to answer any questions and send any additional pictures upon request.
*Most of my items come from estate sales, flea markets, ect.. They are not my personnel items therefore I can't guarantee that they have not been around smoke. 
I will ship Internationally. Buyer must contact me for shipping rates prior to 
purchasing.
Thank you for visiting CatzShinySmiles!        ",69.99,4.8,"Vintage item from the 1950s
Materials:  black wool, black ostrich feather, designer tags, black cloth band, 1950s classic
Only ships within  United States .
Feedback:  175 reviews
Favorited by:  228 people",Accessories Hats & Caps Formal Hats Cloche Hats,175.0,228.0,https://www.etsy.com/listing/245589012/1950s-mr-john-hat-ladies-100-wool,"https://img0.etsystatic.com/104/0/7720150/il_fullxfull.856795366_bffh.jpg,https://img0.etsystatic.com/139/0/7720150/il_fullxfull.856794076_68mr.jpg,https://img0.etsystatic.com/069/0/7720150/il_fullxfull.823222656_cime.jpg,https://img0.etsystatic.com/075/0/7720150/il_fullxfull.823222588_hi47.jpg,https://img1.etsystatic.com/074/0/7720150/il_fullxfull.822995163_f8g2.jpg",,,101
5849,charming antique pocket watch key key chain / vintage albert watch key charm,"
            charming antique  pocket watch key key chain
measurements
key 3.5 cm
key chain 20 cm        ",21.76,5.0,"Vintage item
Ships worldwide from  Australia
Feedback:  40 reviews
Favorited by:  30 people",Accessories Keychains & Lanyards Keychains vintage charm,40.0,30.0,https://www.etsy.com/listing/463733370/charming-antique-pocket-watch-key-key,"https://img1.etsystatic.com/114/1/13096676/il_fullxfull.1085624427_fixz.jpg,https://img0.etsystatic.com/108/0/13096676/il_fullxfull.1039073374_ea5g.jpg,https://img1.etsystatic.com/139/0/13096676/il_fullxfull.1085624077_dgt0.jpg",,,101
